{
  "event_id": "evt_example_referral_001",
  "event_type": "referral-activity",
  "workflow_id": "referral-nurture",
  "source_system": "crm-webhook",
  "received_at": "2026-06-05T12:20:00Z",
  "business_name": "Example Business LLC",
  "contact_name": "Example Referral Partner",
  "contact_role": "Referral Partner",
  "human_review_required": true,
  "safety_flags": {
    "lender_specific_statement": false,
    "underwriting_related_message": false,
    "decline_related_message": false,
    "sensitive_document_handling": false,
    "borrower_facing_claim": false
  },
  "payload": {
    "stage": "partner-nurture",
    "partner_company": "Example Partner Co."
  },
  "example_only": true
}
